{
  "interfaceVersion": "1.1.0",
  "registryVersion": "0.1.0",
  "sourceCapabilities": "Product Foundry shared-interface.yaml",
  "operations": [
    { "operationId": "network.list", "capability": "network.list", "requestSchema": "https://schemas.openrails.dev/openrails/1.1.0/operation-request.schema.json", "responseSchema": "https://schemas.openrails.dev/openrails/1.1.0/operation-response.schema.json", "requestDataSchema": "https://schemas.openrails.dev/openrails/1.1.0/operation-payloads.schema.json#/$defs/EmptyRequest", "responseDataSchema": "https://schemas.openrails.dev/openrails/1.1.0/operation-payloads.schema.json#/$defs/NetworkListResponse", "authorizationClass": "PUBLIC_READ", "allowedExecutionProfiles": ["direct-wallet-authorized", "delegated-runtime"], "transactionBehavior": { "kind": "read-only", "submissionMeansFinancialSuccess": false, "financialSuccessRequirement": "none", "failureCodes": ["NETWORK_UNSUPPORTED", "RPC_UNAVAILABLE"] }, "capabilityStatusBehavior": { "onUnavailable": { "lifecycleState": "FAILED", "transactionState": "NOT_REQUESTED", "errorCode": "CAPABILITY_UNAVAILABLE", "financialEffect": "NONE", "retryable": false }, "onDemonstration": "prepare-or-explain-only; do not claim live financial success", "onRecorded": "preserve provenance and do not upgrade to LIVE without new evidence", "successClaimRule": "financial success requires exact verified receipt and canonical reconciliation" } },
    { "operationId": "network.get", "capability": "network.get", "requestSchema": "https://schemas.openrails.dev/openrails/1.1.0/operation-request.schema.json", "responseSchema": "https://schemas.openrails.dev/openrails/1.1.0/operation-response.schema.json", "requestDataSchema": "https://schemas.openrails.dev/openrails/1.1.0/operation-payloads.schema.json#/$defs/NetworkIdRequest", "responseDataSchema": "https://schemas.openrails.dev/openrails/1.1.0/operation-payloads.schema.json#/$defs/NetworkResponse", "authorizationClass": "PUBLIC_READ", "allowedExecutionProfiles": ["direct-wallet-authorized", "delegated-runtime"], "transactionBehavior": { "kind": "read-only", "submissionMeansFinancialSuccess": false, "financialSuccessRequirement": "none", "failureCodes": ["NETWORK_UNSUPPORTED", "RPC_UNAVAILABLE"] }, "capabilityStatusBehavior": { "onUnavailable": { "lifecycleState": "FAILED", "transactionState": "NOT_REQUESTED", "errorCode": "CAPABILITY_UNAVAILABLE", "financialEffect": "NONE", "retryable": false }, "onDemonstration": "prepare-or-explain-only; do not claim live financial success", "onRecorded": "preserve provenance and do not upgrade to LIVE without new evidence", "successClaimRule": "financial success requires exact verified receipt and canonical reconciliation" } },
    { "operationId": "network.capabilities", "capability": "network.capabilities", "requestSchema": "https://schemas.openrails.dev/openrails/1.1.0/operation-request.schema.json", "responseSchema": "https://schemas.openrails.dev/openrails/1.1.0/operation-response.schema.json", "requestDataSchema": "https://schemas.openrails.dev/openrails/1.1.0/operation-payloads.schema.json#/$defs/NetworkIdRequest", "responseDataSchema": "https://schemas.openrails.dev/openrails/1.1.0/operation-payloads.schema.json#/$defs/CapabilitiesResponse", "authorizationClass": "PUBLIC_READ", "allowedExecutionProfiles": ["direct-wallet-authorized", "delegated-runtime"], "transactionBehavior": { "kind": "read-only", "submissionMeansFinancialSuccess": false, "financialSuccessRequirement": "none", "failureCodes": ["NETWORK_UNSUPPORTED", "RPC_UNAVAILABLE"] }, "capabilityStatusBehavior": { "onUnavailable": { "lifecycleState": "FAILED", "transactionState": "NOT_REQUESTED", "errorCode": "CAPABILITY_UNAVAILABLE", "financialEffect": "NONE", "retryable": false }, "onDemonstration": "prepare-or-explain-only; do not claim live financial success", "onRecorded": "preserve provenance and do not upgrade to LIVE without new evidence", "successClaimRule": "financial success requires exact verified receipt and canonical reconciliation" } },
    { "operationId": "workspace.prepare", "capability": "workspace.prepare", "requestSchema": "https://schemas.openrails.dev/openrails/1.1.0/operation-request.schema.json", "responseSchema": "https://schemas.openrails.dev/openrails/1.1.0/operation-response.schema.json", "requestDataSchema": "https://schemas.openrails.dev/openrails/1.1.0/operation-payloads.schema.json#/$defs/WorkspaceRequest", "responseDataSchema": "https://schemas.openrails.dev/openrails/1.1.0/operation-payloads.schema.json#/$defs/WorkspaceResponse", "authorizationClass": "PREPARE_ONLY", "allowedExecutionProfiles": ["direct-wallet-authorized", "delegated-runtime"], "transactionBehavior": { "kind": "runtime-evaluation", "submissionMeansFinancialSuccess": false, "financialSuccessRequirement": "none", "failureCodes": ["INPUT_INVALID", "CAPABILITY_UNAVAILABLE"] }, "capabilityStatusBehavior": { "onUnavailable": { "lifecycleState": "FAILED", "transactionState": "NOT_REQUESTED", "errorCode": "CAPABILITY_UNAVAILABLE", "financialEffect": "NONE", "retryable": false }, "onDemonstration": "prepare-or-explain-only; do not claim live financial success", "onRecorded": "preserve provenance and do not upgrade to LIVE without new evidence", "successClaimRule": "financial success requires exact verified receipt and canonical reconciliation" } },
    { "operationId": "workspace.get", "capability": "workspace.get", "requestSchema": "https://schemas.openrails.dev/openrails/1.1.0/operation-request.schema.json", "responseSchema": "https://schemas.openrails.dev/openrails/1.1.0/operation-response.schema.json", "requestDataSchema": "https://schemas.openrails.dev/openrails/1.1.0/operation-payloads.schema.json#/$defs/WorkspaceRefRequest", "responseDataSchema": "https://schemas.openrails.dev/openrails/1.1.0/operation-payloads.schema.json#/$defs/WorkspaceResponse", "authorizationClass": "AUTHENTICATED_READ", "allowedExecutionProfiles": ["direct-wallet-authorized", "delegated-runtime"], "transactionBehavior": { "kind": "read-only", "submissionMeansFinancialSuccess": false, "financialSuccessRequirement": "none", "failureCodes": ["AUTHORIZATION_REQUIRED", "STATE_STALE", "RPC_UNAVAILABLE"] }, "capabilityStatusBehavior": { "onUnavailable": { "lifecycleState": "FAILED", "transactionState": "NOT_REQUESTED", "errorCode": "CAPABILITY_UNAVAILABLE", "financialEffect": "NONE", "retryable": false }, "onDemonstration": "prepare-or-explain-only; do not claim live financial success", "onRecorded": "preserve provenance and do not upgrade to LIVE without new evidence", "successClaimRule": "financial success requires exact verified receipt and canonical reconciliation" } },
    { "operationId": "workspace.list", "capability": "workspace.list", "requestSchema": "https://schemas.openrails.dev/openrails/1.1.0/operation-request.schema.json", "responseSchema": "https://schemas.openrails.dev/openrails/1.1.0/operation-response.schema.json", "requestDataSchema": "https://schemas.openrails.dev/openrails/1.1.0/operation-payloads.schema.json#/$defs/EmptyRequest", "responseDataSchema": "https://schemas.openrails.dev/openrails/1.1.0/operation-payloads.schema.json#/$defs/WorkspaceListResponse", "authorizationClass": "AUTHENTICATED_READ", "allowedExecutionProfiles": ["direct-wallet-authorized", "delegated-runtime"], "transactionBehavior": { "kind": "read-only", "submissionMeansFinancialSuccess": false, "financialSuccessRequirement": "none", "failureCodes": ["AUTHORIZATION_REQUIRED", "STATE_STALE", "RPC_UNAVAILABLE"] }, "capabilityStatusBehavior": { "onUnavailable": { "lifecycleState": "FAILED", "transactionState": "NOT_REQUESTED", "errorCode": "CAPABILITY_UNAVAILABLE", "financialEffect": "NONE", "retryable": false }, "onDemonstration": "prepare-or-explain-only; do not claim live financial success", "onRecorded": "preserve provenance and do not upgrade to LIVE without new evidence", "successClaimRule": "financial success requires exact verified receipt and canonical reconciliation" } },
    { "operationId": "actor.prepareRegistration", "capability": "actor.prepareRegistration", "requestSchema": "https://schemas.openrails.dev/openrails/1.1.0/operation-request.schema.json", "responseSchema": "https://schemas.openrails.dev/openrails/1.1.0/operation-response.schema.json", "requestDataSchema": "https://schemas.openrails.dev/openrails/1.1.0/operation-payloads.schema.json#/$defs/ActorRequest", "responseDataSchema": "https://schemas.openrails.dev/openrails/1.1.0/operation-payloads.schema.json#/$defs/ActorResponse", "authorizationClass": "WALLET_SIGNATURE", "allowedExecutionProfiles": ["direct-wallet-authorized", "delegated-runtime"], "transactionBehavior": { "kind": "wallet-signature", "submissionMeansFinancialSuccess": false, "financialSuccessRequirement": "none", "failureCodes": ["AUTHORIZATION_REQUIRED", "WALLET_REJECTED", "SIGNATURE_INVALID", "SIGNATURE_EXPIRED", "NONCE_CONFLICT"] }, "capabilityStatusBehavior": { "onUnavailable": { "lifecycleState": "FAILED", "transactionState": "NOT_REQUESTED", "errorCode": "CAPABILITY_UNAVAILABLE", "financialEffect": "NONE", "retryable": false }, "onDemonstration": "prepare-or-explain-only; do not claim live financial success", "onRecorded": "preserve provenance and do not upgrade to LIVE without new evidence", "successClaimRule": "financial success requires exact verified receipt and canonical reconciliation" } },